{
  "attributes": {
    "raw": {
      "document": "---\ntitle: \"Elastic Global Threat Report Multipart Series Overview\"\nslug: \"gtr-multipart-series-overview\"\ndate: \"2023-04-24\"\ndescription: \"Each month, the Elastic Security Labs team dissects a different trend or correlation from the Elastic Global Threat Report. This post provides an overview of those individual publications.\"\nauthor:\n  - slug: devon-kerr\nimage: \"gtr-blog-image-720x420.png\"\ncategory:\n  - slug: reports\n  - slug: security-research\n---\n\nWhen we [announced](https://www.elastic.co/security-labs/2022-elastic-global-threat-report-announcement) the inaugural Elastic Global Threat Report last year, the Elastic Security Labs team knew we wanted to follow it with a series that went a little deeper on several topics like trends and forecasting. Not only would this allow us to keep the report concise, but it would provide us with a way to be more transparent by diving deep.\n\nThis post will be updated with each new article in the series, published monthly:\n\n- [Topic: Defense Evasion](https://www.elastic.co/blog/elastic-global-threat-report-breakdown-defense-evasion)\n- [Topic: Credential Access](https://www.elastic.co/blog/elastic-global-threat-report-breakdown-credential-access)\n\nIn April, we published an [updated](https://ela.st/gtr) version of the Global Threat Report Spring Edition which included new insights online and interactive.\n"
    },
    "title": "Elastic Global Threat Report Multipart Series Overview",
    "slug": "gtr-multipart-series-overview",
    "date": "2023-04-24",
    "description": "Each month, the Elastic Security Labs team dissects a different trend or correlation from the Elastic Global Threat Report. This post provides an overview of those individual publications.",
    "author": [
      {
        "slug": "devon-kerr"
      }
    ],
    "image": "gtr-blog-image-720x420.png",
    "category": [
      {
        "slug": "reports"
      },
      {
        "slug": "security-research"
      }
    ]
  },
  "id": "security_labs_content-gtr_multipart_series_overview-md",
  "type": "security_labs_content"
}
